{
  "version": "v1.0",
  "metadata": {
    "kind": "trigger"
  },
  "trigger": {
    "displayName": "Google Calendar"
  },
  "listeners": [
    {
      "target": "$listener"
    }
  ],
  "serviceTypes": [
    {
      "target": "$calendarService"
    }
  ],
  "artifactInfo": {
    "displayLabel": "Google Calendar Event Integration",
    "icon": {
      "lightPath": "icons/light.svg",
      "darkPath": "icons/dark.svg"
    }
  }
}
